{
  "schema_version": "review-brief.v1",
  "repository": {
    "owner": "pallets",
    "name": "flask",
    "full_name": "pallets/flask",
    "html_url": "https://github.com/pallets/flask"
  },
  "pull_request": {
    "number": 5827,
    "title": "clarify 415 vs 400 errors for request.json",
    "author": "adityasah104",
    "html_url": "https://github.com/pallets/flask/pull/5827",
    "state": "closed",
    "draft": false,
    "created_at": "2025-10-09T07:06:09Z",
    "updated_at": "2026-02-09T00:13:53Z",
    "merged_at": "2026-01-25T02:46:57Z",
    "head": {
      "ref": "docs-clarify-json-415-error",
      "sha": "3962683c5bd9477182d980a1081f5effb46c8ed2",
      "repo_full_name": "adityasah104/flask"
    },
    "base": {
      "ref": "stable",
      "sha": "25642fd1fd65985fc98f95e64bc2c7ff353d6c2b",
      "repo_full_name": "pallets/flask"
    },
    "commits": 2,
    "additions": 5,
    "deletions": 3,
    "changed_files": 1,
    "body_present": true,
    "body_length": 549
  },
  "size": {
    "files": 1,
    "additions": 5,
    "deletions": 3,
    "diff_bytes": 1183,
    "diff_lines": 27
  },
  "ci": {
    "head_sha": "3962683c5bd9477182d980a1081f5effb46c8ed2",
    "state": "success",
    "total": 3,
    "successful": 3,
    "failed": 0,
    "pending": 0,
    "skipped": 0,
    "items": [
      {
        "kind": "check_run",
        "name": "main",
        "state": "success",
        "status": "completed",
        "conclusion": "success",
        "url": "https://github.com/pallets/flask/actions/runs/21325681472/job/61382292009"
      },
      {
        "kind": "check_run",
        "name": "main",
        "state": "success",
        "status": "completed",
        "conclusion": "success",
        "url": "https://github.com/pallets/flask/actions/runs/21325625491/job/61382150782"
      },
      {
        "kind": "status",
        "name": "docs/readthedocs.org:flask",
        "state": "success",
        "status": "success",
        "conclusion": "success",
        "url": "https://flask--5827.org.readthedocs.build/en/5827/"
      }
    ]
  },
  "categories": {
    "code": 0,
    "tests": 0,
    "documentation": 1,
    "ci": 0,
    "automation": 0,
    "dependencies": 0,
    "configuration": 0,
    "security": 0,
    "migrations": 0,
    "release": 0,
    "build": 0,
    "generated": 0,
    "unknown": 0
  },
  "signals": [
    {
      "id": "small_pr",
      "level": "info",
      "title": "Small pull request",
      "message": "This PR is small by file and line thresholds.",
      "evidence": [
        {
          "kind": "metadata",
          "value": "1 files, +5 / -3",
          "reason": "<= 5 files and <= 200 changed lines"
        }
      ]
    },
    {
      "id": "docs_only",
      "level": "info",
      "title": "Documentation-only change",
      "message": "All changed files are documentation.",
      "evidence": [
        {
          "kind": "file",
          "value": "docs/patterns/javascript.rst",
          "reason": "all changed files are documentation"
        }
      ]
    }
  ],
  "attention": "low",
  "recommended_action": "normal_review",
  "priority_files": [
    {
      "path": "docs/patterns/javascript.rst",
      "categories": [
        "documentation"
      ],
      "changes": 8,
      "reason": "documentation"
    }
  ],
  "questions": [],
  "data_confidence": {
    "source": "github",
    "diff_available": true,
    "file_count_matches_metadata": true,
    "ci_available": true
  },
  "limitations": [
    "This brief is based on GitHub metadata, changed files and diff data. It does not replace code review.",
    "PR Signal does not execute code, install dependencies, approve, reject or score the PR."
  ]
}
